{
  "schemaVersion": "2.0.0",
  "documentVersion": "1.0.10",
  "id": "artifact-manager-script-completeness",
  "artifactType": "intake",
  "projectId": "agent-factory",
  "lifecycle": {
    "phase": "intake",
    "status": "ready"
  },
  "createdAt": "2026-07-17T18:40:49+00:00",
  "updatedAt": "2026-07-17T18:40:54+00:00",
  "language": "ko",
  "theme": "default",
  "provenance": {
    "createdBy": "Human",
    "generatedBy": "Agent Factory intake manager",
    "sourceRefs": []
  },
  "relations": [],
  "readiness": {
    "contractValid": true,
    "evidenceComplete": true,
    "requirementsComplete": true,
    "specificationConsistent": true,
    "executionReady": true,
    "reviewedAt": "2026-07-18T00:00:00+09:00",
    "findings": []
  }
}
