{
  "schemaVersion": "2.0.0",
  "documentVersion": "1.0.31",
  "id": "consolidate-agent-factory-skills-into-eight",
  "artifactType": "intake",
  "projectId": "agent-factory",
  "lifecycle": {
    "phase": "intake",
    "status": "ready"
  },
  "createdAt": "2026-08-01T07:58:27+00:00",
  "updatedAt": "2026-08-01T09:45:06+00:00",
  "language": "ko",
  "theme": "default",
  "provenance": {
    "createdBy": "Human",
    "generatedBy": "Agent Factory intake manager",
    "sourceRefs": []
  },
  "relations": [],
  "readiness": {
    "reviewedAt": "2026-08-01T09:44:39.525Z",
    "contractValid": true,
    "evidenceComplete": true,
    "requirementsComplete": true,
    "specificationConsistent": true,
    "executionReady": true,
    "findings": []
  }
}
