{
  "schemaVersion": "2.0.0",
  "documentVersion": "1.0.19",
  "id": "intake-agent-sandbox-compatibility",
  "artifactType": "intake",
  "projectId": "agent-factory-codex-plugins",
  "lifecycle": {
    "phase": "intake",
    "status": "ready"
  },
  "createdAt": "2026-08-05T15:55:17+00:00",
  "updatedAt": "2026-08-05T15:55:33+00:00",
  "language": "ko",
  "theme": "default",
  "provenance": {
    "createdBy": "Human",
    "generatedBy": "Agent Factory intake manager",
    "sourceRefs": []
  },
  "relations": [],
  "readiness": {
    "reviewedAt": "2026-08-06T00:00:00+09:00",
    "contractValid": true,
    "evidenceComplete": true,
    "requirementsComplete": true,
    "specificationConsistent": true,
    "executionReady": true,
    "findings": []
  }
}
