{
  "schemaVersion": "2.0.0",
  "documentVersion": "1.0.47",
  "id": "human-review-contextual-approval",
  "artifactType": "intake",
  "projectId": "agent-factory-codex-plugins",
  "lifecycle": {
    "phase": "intake",
    "status": "draft"
  },
  "createdAt": "2026-07-27T13:56:36+00:00",
  "updatedAt": "2026-07-29T12:23:33+00:00",
  "language": "ko",
  "theme": "default",
  "provenance": {
    "createdBy": "Human",
    "generatedBy": "Agent Factory intake manager",
    "sourceRefs": []
  },
  "relations": [],
  "readiness": {
    "reviewedAt": null,
    "contractValid": true,
    "evidenceComplete": false,
    "requirementsComplete": false,
    "specificationConsistent": false,
    "executionReady": false,
    "findings": []
  }
}
