{
  "schemaVersion": "2.0.0",
  "documentVersion": "1.0.10",
  "id": "ruff-format-python-skills",
  "artifactType": "intake",
  "projectId": "agent-factory",
  "lifecycle": {
    "phase": "intake",
    "status": "closed"
  },
  "createdAt": "2026-07-18T13:58:11+00:00",
  "updatedAt": "2026-07-18T14:06:19+00:00",
  "language": "ko",
  "theme": "default",
  "provenance": {
    "createdBy": "Human",
    "generatedBy": "Agent Factory intake manager",
    "sourceRefs": []
  },
  "relations": [],
  "readiness": {
    "contractValid": true,
    "evidenceComplete": false,
    "requirementsComplete": false,
    "specificationConsistent": false,
    "executionReady": false,
    "reviewedAt": null,
    "findings": []
  }
}
