{
  "schemaVersion": "2.0.0",
  "documentVersion": "1.0.13",
  "id": "prevent-direct-artifact-json-authoring",
  "artifactType": "intake",
  "projectId": "agent-factory",
  "lifecycle": {
    "phase": "intake",
    "status": "draft"
  },
  "createdAt": "2026-07-26T09:36:45+00:00",
  "updatedAt": "2026-07-26T10:46:28+00:00",
  "language": "ko",
  "theme": "default",
  "provenance": {
    "createdBy": "Human",
    "generatedBy": "Agent Factory intake manager",
    "sourceRefs": []
  },
  "relations": [],
  "readiness": {
    "reviewedAt": null,
    "contractValid": true,
    "evidenceComplete": false,
    "requirementsComplete": false,
    "specificationConsistent": false,
    "executionReady": false,
    "findings": []
  }
}
