{
  "schemaVersion": "2.0.0",
  "documentVersion": "1.0.28",
  "id": "main-workflow-agent-role-split",
  "artifactType": "intake",
  "projectId": "agent-factory-codex-plugins",
  "lifecycle": {
    "phase": "intake",
    "status": "ready"
  },
  "createdAt": "2026-07-27T13:06:41+00:00",
  "updatedAt": "2026-07-27T13:19:18+00:00",
  "language": "ko",
  "theme": "default",
  "provenance": {
    "createdBy": "Human",
    "generatedBy": "Agent Factory intake manager",
    "sourceRefs": []
  },
  "relations": [],
  "readiness": {
    "reviewedAt": "2026-07-27T13:19:16Z",
    "contractValid": true,
    "evidenceComplete": true,
    "requirementsComplete": true,
    "specificationConsistent": true,
    "executionReady": true,
    "findings": []
  }
}
