{
  "schemaVersion": "2.0.0",
  "documentVersion": "1.0.18",
  "id": "work-unit-status-and-legacy-cleanup",
  "artifactType": "intake",
  "projectId": "agent-factory",
  "lifecycle": {
    "phase": "intake",
    "status": "ready"
  },
  "createdAt": "2026-07-27T15:39:49+00:00",
  "updatedAt": "2026-07-27T15:49:07+00:00",
  "language": "ko",
  "theme": "default",
  "provenance": {
    "createdBy": "Human",
    "generatedBy": "Agent Factory intake manager",
    "sourceRefs": []
  },
  "relations": [],
  "readiness": {
    "reviewedAt": "2026-07-28T00:48:45+09:00",
    "contractValid": true,
    "evidenceComplete": true,
    "requirementsComplete": true,
    "specificationConsistent": true,
    "executionReady": true,
    "findings": []
  }
}
